{
  "id": "prd-001",
  "version": "1.0.0",
  "features": [
    {
      "id": "F001",
      "name": "User Authentication",
      "description": "Secure user authentication system",
      "priority": "critical"
    },
    {
      "id": "F002",
      "name": "Dashboard",
      "description": "User dashboard with metrics",
      "priority": "high"
    }
  ],
  "userStories": [
    {
      "id": "US001",
      "as": "a user",
      "want": "to log in securely",
      "so": "I can access my personal data"
    },
    {
      "id": "US002",
      "as": "an admin",
      "want": "to view system metrics",
      "so": "I can monitor system health"
    }
  ],
  "acceptanceCriteria": [
    {
      "id": "AC001",
      "criteria": "Users can log in with email and password",
      "testable": true
    },
    {
      "id": "AC002",
      "criteria": "Dashboard loads within 2 seconds",
      "testable": true
    }
  ]
}